{
  "archive_manifest_hash": "0e75e9fe6ac2c45611bf06db938571c963ed6ed04a04c680ea8512309c9145de",
  "attestation_count": 0,
  "audit_chain_head_hash": "2bdfb68eff437cfc0ec40ef8c329b32defa6b2848ff63402082f48512a3a570f",
  "audit_entry_count": 2,
  "evidence_count": 1,
  "justification_count": 0,
  "manifest_hash": "173753cf992474c767ff7fd29d96a613827c434444f35d8a4dedb43df1e2f6b2",
  "manifest_type": "aip.transparency.manifest.v1",
  "operator_id": "jmm-evergreen",
  "previous_manifest_hash": "81f9a6552ce97012167118246277e64bb937bfb912948f3d3c174e5ea5f62970",
  "public_key_fingerprint": "c8a9c6d4e10c7e644be9310806b65a3405cdfedac642974df0b9b362c93a0f55",
  "schema_version": "1",
  "sequence": 1,
  "signature": "5297be2914c006882610384f5c24dbd7712a3c0524139d521be141151b9fb7f52c3c1aad3df71a00286968229dc2afee29c36cdbde7887834baeba30afef600a",
  "signature_algorithm": "ed25519-v1",
  "signed_at": "2026-06-09T15:58:24Z",
  "snapshot_count": 0,
  "timeline_count": 0,
  "workspace_count": 0
}
